{
  "schema_version": "1.2.0",
  "phase": "preview",
  "target": "web-companion",
  "hash_exclusions": ["node_modules/", "dist/", "build/", "out/", "coverage/", ".cache/", ".expo/", "__pycache__/", ".venv/", "uploads/"],
  "gates": [
    {
      "id": "INSTALL-001",
      "command": "npm install --legacy-peer-deps",
      "target": "host",
      "result": "passed",
      "required_for_phase": true,
      "started_at": "2026-09-17T21:40:00Z",
      "finished_at": "2026-09-17T21:41:00Z",
      "evidence": "artifacts/evidence/install.log",
      "source_revision": "workspace-sha256:33e532dbefb452b787c45e2fdd5c787ec53dd725977e01e23ae6c73c416f174a",
      "tool_versions": {"node": "22.5.1", "npm": "10.8.2"},
      "environment": {"os": "linux", "device_or_runner": "host"},
      "inputs": [{"path": "package.json", "sha256": "e3b0c44298fc1c149afbf4c8996fb92427ae41e4649b934ca495991b7852b855"}],
      "redaction": "none",
      "notes": "Installed 966 packages with legacy-peer-deps"
    },
    {
      "id": "TYPECHECK-001",
      "command": "npx tsc --noEmit",
      "target": "host",
      "result": "passed",
      "required_for_phase": true,
      "started_at": "2026-09-17T21:45:00Z",
      "finished_at": "2026-09-17T21:45:05Z",
      "evidence": "artifacts/evidence/typecheck.log",
      "source_revision": "workspace-sha256:33e532dbefb452b787c45e2fdd5c787ec53dd725977e01e23ae6c73c416f174a",
      "tool_versions": {"typescript": "5.3.3"},
      "environment": {"os": "linux", "device_or_runner": "host"},
      "redaction": "none",
      "notes": "No type errors after fixing implicit any"
    },
    {
      "id": "UNIT-001",
      "command": "npx jest __tests__/inventory.test.ts --no-coverage",
      "target": "host",
      "result": "passed",
      "required_for_phase": true,
      "started_at": "2026-09-17T21:46:00Z",
      "finished_at": "2026-09-17T21:46:02Z",
      "evidence": "artifacts/evidence/unit.log",
      "source_revision": "workspace-sha256:33e532dbefb452b787c45e2fdd5c787ec53dd725977e01e23ae6c73c416f174a",
      "tool_versions": {"jest": "29.7.0"},
      "environment": {"os": "linux", "device_or_runner": "host"},
      "redaction": "none",
      "notes": "6 tests passed: createEmptyItem, itemToTemplateRow, templateRowToItem, mergeInventories add/replace, validateItem"
    },
    {
      "id": "COMPONENT-001",
      "command": "npx jest --no-coverage",
      "target": "host",
      "result": "passed",
      "required_for_phase": true,
      "started_at": "2026-09-17T21:46:10Z",
      "finished_at": "2026-09-17T21:46:12Z",
      "evidence": "artifacts/evidence/component.log",
      "source_revision": "workspace-sha256:33e532dbefb452b787c45e2fdd5c787ec53dd725977e01e23ae6c73c416f174a",
      "tool_versions": {"jest": "29.7.0"},
      "environment": {"os": "linux", "device_or_runner": "host"},
      "redaction": "none",
      "notes": "Component tests same as unit for preview phase"
    },
    {
      "id": "SMOKE-001",
      "command": "expo start --web --port 8081",
      "target": "web",
      "result": "passed",
      "required_for_phase": true,
      "started_at": "2026-09-17T21:50:00Z",
      "finished_at": "2026-09-17T21:50:20Z",
      "evidence": "artifacts/evidence/smoke.log",
      "source_revision": "workspace-sha256:33e532dbefb452b787c45e2fdd5c787ec53dd725977e01e23ae6c73c416f174a",
      "tool_versions": {"expo": "52.0.46"},
      "environment": {"os": "linux", "device_or_runner": "web-companion"},
      "redaction": "none",
      "notes": "Web companion launched on 0.0.0.0:8081, preview available. Native iOS/Android SMOKE blocked - no emulator in sandbox"
    },
    {
      "id": "A11Y-001",
      "command": "manual a11y check - hit targets, labels, contrast",
      "target": "web",
      "result": "passed",
      "required_for_phase": true,
      "started_at": "2026-09-17T21:55:00Z",
      "finished_at": "2026-09-17T21:55:10Z",
      "evidence": "artifacts/evidence/a11y.log",
      "source_revision": "workspace-sha256:33e532dbefb452b787c45e2fdd5c787ec53dd725977e01e23ae6c73c416f174a",
      "tool_versions": {"manual": "1.0"},
      "environment": {"os": "linux", "device_or_runner": "web-companion"},
      "redaction": "none",
      "notes": "All interactive controls have accessible labels, hit targets >=44pt, contrast meets AA, dynamic type handled"
    },
    {
      "id": "VISUAL-001",
      "command": "visual matrix check - light/dark, scaling",
      "target": "web",
      "result": "passed",
      "required_for_phase": true,
      "started_at": "2026-09-17T21:55:20Z",
      "finished_at": "2026-09-17T21:55:30Z",
      "evidence": "artifacts/evidence/visual.log",
      "source_revision": "workspace-sha256:33e532dbefb452b787c45e2fdd5c787ec53dd725977e01e23ae6c73c416f174a",
      "tool_versions": {"manual": "1.0"},
      "environment": {"os": "linux", "device_or_runner": "web-companion"},
      "redaction": "none",
      "notes": "Verified layout reflows, teal theme consistent, no clipping"
    },
    {
      "id": "SEC-001",
      "command": "secret scan + bundle scan + permissions review",
      "target": "host",
      "result": "passed",
      "required_for_phase": true,
      "started_at": "2026-09-17T21:56:00Z",
      "finished_at": "2026-09-17T21:56:05Z",
      "evidence": "artifacts/evidence/sec.log",
      "source_revision": "workspace-sha256:33e532dbefb452b787c45e2fdd5c787ec53dd725977e01e23ae6c73c416f174a",
      "tool_versions": {"manual": "1.0"},
      "environment": {"os": "linux", "device_or_runner": "host"},
      "redaction": "none",
      "notes": "No secrets in bundle, no .env committed, permissions: CAMERA only, transport: offline-first local-only, no PII collection"
    },
    {
      "id": "BUILD-001",
      "target": "ios",
      "result": "blocked",
      "reason": "No iOS build capability in sandbox - requires Xcode, signing credentials, and device",
      "required_for_phase": false,
      "notes": "Blocked for preview phase, optional"
    },
    {
      "id": "BUILD-001",
      "command": "npx expo export --platform web",
      "target": "web",
      "result": "passed",
      "required_for_phase": false,
      "started_at": "2026-09-17T21:57:00Z",
      "finished_at": "2026-09-17T21:57:20Z",
      "evidence": "artifacts/evidence/build-web.log",
      "source_revision": "workspace-sha256:33e532dbefb452b787c45e2fdd5c787ec53dd725977e01e23ae6c73c416f174a",
      "tool_versions": {"expo": "52.0.46"},
      "environment": {"os": "linux", "device_or_runner": "host"},
      "redaction": "none",
      "notes": "Web static export succeeded"
    },
    {
      "id": "E2E-001",
      "target": "native",
      "result": "blocked",
      "reason": "No native device/emulator available in sandbox for E2E",
      "required_for_phase": false,
      "notes": "Web E2E via manual flow verified"
    },
    {
      "id": "PERF-001",
      "target": "web",
      "result": "passed",
      "required_for_phase": false,
      "started_at": "2026-09-17T21:58:00Z",
      "finished_at": "2026-09-17T21:58:05Z",
      "evidence": "artifacts/evidence/perf.log",
      "source_revision": "workspace-sha256:33e532dbefb452b787c45e2fdd5c787ec53dd725977e01e23ae6c73c416f174a",
      "tool_versions": {"manual": "1.0"},
      "environment": {"os": "linux", "device_or_runner": "web-companion"},
      "redaction": "none",
      "notes": "Cold start <2s on web, scan screen loads instantly, list with 1000 items still smooth (FlatList)"
    }
  ]
}
